{
  "schemaVersion": "framework-pack-authoring-v1",
  "packId": "expectations_investing_public_frameworks_v0_1",
  "name": "Mauboussin / Rappaport Expectations Investing Public Frameworks — Research Draft",
  "version": "0.1.0",
  "description": "Ten independently reviewable cards spanning price-implied expectations, private-round normalization, operating drivers, implied duration, trigger sensitivity, strategy, base rates, expected value, event revisions, and growth options.",
  "cardFiles": [
    "cards/ei-01-price-implied-expectations.card.json",
    "cards/ei-02-private-round-expectations-bridge.card.json",
    "cards/ei-03-expectations-infrastructure.card.json",
    "cards/ei-04-implied-advantage-period.card.json",
    "cards/ei-05-turbo-trigger-sensitivity.card.json",
    "cards/ei-06-strategy-revision-test.card.json",
    "cards/ei-07-base-rate-update.card.json",
    "cards/ei-08-scenario-expected-value.card.json",
    "cards/ei-09-event-revision-map.card.json",
    "cards/ei-10-growth-option-separation.card.json"
  ],
  "sourceCatalog": "sources.json",
  "executionPolicy": {
    "independentLensExecution": true,
    "preserveDisagreements": true,
    "hiddenChainOfThought": false,
    "formalDecisionFactorRule": "Only cards with decisionUtility.status=validated_decision_factor may carry non-zero formal decision weight."
  },
  "review": {
    "contentStatus": "draft",
    "publicationStatus": "unpublished",
    "openIssues": [
      "Complete lawful review of the 2021 revised edition with exact chapter and page locators.",
      "Validate the private-round security-normalization bridge with valuation and venture-finance experts.",
      "Validate reverse-solver identifiability, sensitivity, and value-object contracts.",
      "Backtest event-to-driver mapping and false-positive controls.",
      "Complete rights, Framework Fidelity, and Decision Utility review before seed conversion."
    ]
  }
}
