{
  "schemaVersion": "framework-pack-authoring-v1",
  "packId": "noam_wasserman_founders_dilemmas_public_frameworks_v0_1",
  "name": "Noam Wasserman / The Founder's Dilemmas Public Frameworks — Research Draft",
  "version": "0.1.0",
  "description": "Ten cards for founder timing, team formation, relationships, roles, equity, hiring, investors, succession, wealth-control alignment, and investor diligence.",
  "cardFiles": [
    "cards/fd-01-founder-dilemma-applicability.card.json",
    "cards/fd-02-founding-timing-readiness.card.json",
    "cards/fd-03-cofounder-relationship-choice.card.json",
    "cards/fd-04-role-decision-rights.card.json",
    "cards/fd-05-equity-vesting-alignment.card.json",
    "cards/fd-06-nonfounder-hiring-scale.card.json",
    "cards/fd-07-investor-resource-control.card.json",
    "cards/fd-08-founder-ceo-succession.card.json",
    "cards/fd-09-rich-king-goal-alignment.card.json",
    "cards/fd-10-founder-organization-diligence-bridge.card.json"
  ],
  "sourceCatalog": "sources.json",
  "executionPolicy": {
    "independentLensExecution": true,
    "preserveDisagreements": true,
    "hiddenChainOfThought": false,
    "formalDecisionFactorRule": "Only cards with decisionUtility.status=validated_decision_factor may carry non-zero formal decision weight."
  },
  "review": {
    "contentStatus": "draft",
    "publicationStatus": "unpublished",
    "openIssues": [
      "Complete licensed-book review for chapters with limited public coverage.",
      "Verify empirical statistics against original tables and samples.",
      "Define privacy and consent rules for team evidence.",
      "Backtest team-risk flags.",
      "Complete Framework Fidelity and Decision Utility review."
    ]
  }
}
