{
  "schemaVersion": "framework-pack-authoring-v1",
  "packId": "mahendra_ramsinghani_business_of_vc_public_frameworks_v0_1",
  "name": "Mahendra Ramsinghani / The Business of Venture Capital Public Frameworks — Research Draft",
  "version": "0.1.0",
  "description": "Ten independently reviewable cards connecting fund strategy, portfolio construction, capital reserves, performance, sourcing, diligence, fund fit, value creation, and exits.",
  "cardFiles": [
    "cards/bvc-01-fund-strategy-sandbox.card.json",
    "cards/bvc-02-fund-size-portfolio-construction.card.json",
    "cards/bvc-03-check-ownership-capital-path.card.json",
    "cards/bvc-04-reserve-follow-on-policy.card.json",
    "cards/bvc-05-performance-attribution.card.json",
    "cards/bvc-06-sourcing-and-revisit-memory.card.json",
    "cards/bvc-07-stage-appropriate-diligence.card.json",
    "cards/bvc-08-fund-fit-gate.card.json",
    "cards/bvc-09-value-creation-capacity.card.json",
    "cards/bvc-10-exit-liquidity-path.card.json"
  ],
  "sourceCatalog": "sources.json",
  "executionPolicy": {
    "independentLensExecution": true,
    "preserveDisagreements": true,
    "hiddenChainOfThought": false,
    "formalDecisionFactorRule": "Only cards with decisionUtility.status=validated_decision_factor may carry non-zero formal decision weight."
  },
  "review": {
    "contentStatus": "draft",
    "publicationStatus": "unpublished",
    "openIssues": [
      "Complete lawful Chapter 13 and 14 review before attributing detailed portfolio or performance rules.",
      "Validate fund-policy defaults, reserve logic, and capital-path calculations.",
      "Backtest fund-fit and sourcing-revisit outputs.",
      "Complete rights, Framework Fidelity, and Decision Utility review."
    ]
  }
}
