{
  "schemaVersion": "framework-pack-authoring-v1",
  "packId": "howard_marks_most_important_thing_public_frameworks_v0_1",
  "name": "Howard Marks / The Most Important Thing Public Frameworks — Research Draft",
  "version": "0.1.0",
  "description": "Ten independently reviewable cards for consensus, price and value, risk, cycles, contrarianism, patience, process, and VC-appropriate asymmetry.",
  "cardFiles": [
    "cards/mmi-01-second-level-consensus-gap.card.json",
    "cards/mmi-02-price-value-financing-discipline.card.json",
    "cards/mmi-03-permanent-loss-risk-map.card.json",
    "cards/mmi-04-risk-control-not-avoidance.card.json",
    "cards/mmi-05-cycle-capital-market-transmission.card.json",
    "cards/mmi-06-market-temperature-posture.card.json",
    "cards/mmi-07-intelligent-contrarianism.card.json",
    "cards/mmi-08-patient-opportunistic-deployment.card.json",
    "cards/mmi-09-process-outcome-luck-ledger.card.json",
    "cards/mmi-10-strategy-specific-asymmetry.card.json"
  ],
  "sourceCatalog": "sources.json",
  "executionPolicy": {
    "independentLensExecution": true,
    "preserveDisagreements": true,
    "hiddenChainOfThought": false,
    "formalDecisionFactorRule": "Only cards with decisionUtility.status=validated_decision_factor may carry non-zero formal decision weight."
  },
  "review": {
    "contentStatus": "draft",
    "publicationStatus": "unpublished",
    "openIssues": [
      "Complete lawful chapter-level review of the 2013 illuminated edition.",
      "Validate public-market-to-venture transfer conditions.",
      "Backtest market-temperature, contrarian, and asymmetry outputs.",
      "Complete rights, Framework Fidelity, and Decision Utility review."
    ]
  }
}

